id,title,overview,mainResponsibilities,tasks,knowledge,skills,skillKeywords,education,preferredExperience,certifications,experienceMin,experienceMax,weight_skills,weight_knowledge,weight_tasks,weight_certifications,weight_education,thresholdScore,testCategory
7,Cybersecurity Policy & Planning Analyst,"The Cybersecurity Policy & Planning Analyst develops, maintains, and aligns cybersecurity policies, strategies, and governance frameworks to ensure organizational compliance and effective risk management. This role partners with leadership, legal, risk, and technical teams to translate cybersecurity requirements into actionable policies and strategic plans that strengthen the organization’s overall security posture.","Develop and maintain cybersecurity policies, procedures, and governance frameworks aligned with organizational goals and risk management frameworks such as NIST RMF or ISO 27005 | Evaluate cybersecurity requirements, regulatory obligations, and industry standards to ensure compliance with cybersecurity laws, regulations, and compliance frameworks | Advise leadership and stakeholders on cybersecurity policy implications, strategic direction, and governance processes | Conduct audits and assessments to verify the effectiveness of cybersecurity policies, controls, and organizational policy structures | Research emerging technologies, threats, privacy laws, and regulatory changes to update policy guidance and strategic plans | Identify partner or stakeholder capabilities to support policy implementation and detect exploitation activities that may impact policy decisions | Establish and maintain communication channels with internal and external stakeholders for policy coordination and collaboration across business units | Promote cybersecurity awareness and policy understanding across management and staff through training and communication initiatives | Apply knowledge of enterprise IT architecture, network security fundamentals, and cyber defense tools to align controls with policies | Integrate organizational objectives with cybersecurity principles, threats, vulnerabilities, and enterprise security practices","Develop and maintain cybersecurity policies, procedures, and governance frameworks aligned with organizational goals. | Evaluate cybersecurity requirements, regulatory obligations, and industry standards to ensure compliance. | Advise leadership and stakeholders on cybersecurity policy implications and strategic direction. | Conduct audits and assessments to verify the effectiveness of cybersecurity policies and controls. | Research emerging technologies, threats, and regulatory changes to update policy guidance. | Establish and maintain communication channels with internal and external stakeholders for policy coordination. | Promote cybersecurity awareness and policy understanding across management and staff.","Cybersecurity laws, regulations, and compliance frameworks. | Cybersecurity policies, governance processes, and organizational policy structures. | Risk management frameworks such as NIST RMF, ISO 27005, or similar. | Cybersecurity principles, threats, vulnerabilities, and enterprise security practices. | Privacy laws, data protection principles, and information governance models. | Enterprise IT architecture concepts, network security fundamentals, and controls alignment. | Cyber defense tools, assessment techniques, and vulnerability management concepts.","Skill in developing cybersecurity policies, strategic plans, and governance documentation. | Ability to assess organizational requirements and map them to cybersecurity controls and policies. | Skill in identifying partner or stakeholder capabilities to support policy implementation. | Ability to detect exploitation activities and integrate findings into policy decisions. | Strong collaboration and communication skills for engaging stakeholders across business units.",cybersecurity policy | governance | risk management | compliance | strategic planning | policy development | regulatory alignment,"Bachelor’s degree in Information Security, IT Management, Business Administration, Political Science, Public Administration, or a related field.","2–5 years of experience in cybersecurity governance, policy development, risk management, or compliance. | Experience working with frameworks such as NIST CSF, NIST RMF, ISO 27001, or COBIT. | Experience collaborating with cross-functional teams in security, legal, audit, and risk domains.",ISACA CISM | ISC2 CGRC (formerly CAP) | ISO 27001 Lead Implementer or Lead Auditor | IAPP CIPM (for privacy governance alignment) | Associate of ISC2 (towards CISSP),2,5,0.40,0.30,0.20,0.05,0.05,60,policy_and_governance
8,Privacy Governance Analyst,"The Privacy Governance Analyst supports the development, implementation, and oversight of the organization’s privacy compliance program. The role ensures policies, processes, and data governance practices align with privacy laws, regulatory requirements, and organizational objectives. This position bridges legal, security, and operational teams to reduce privacy risks, strengthen PII management, and maintain a culture of privacy awareness across the enterprise.","Develop and maintain privacy policies, procedures, and governance documentation aligned with regulatory requirements such as GDPR, CCPA, and HIPAA | Conduct Privacy Impact Assessments (PIAs) and evaluate systems, processes, and services for privacy compliance and PII protection | Monitor organizational compliance with privacy laws, internal policies, and industry standards using privacy principles and data lifecycle management concepts | Identify privacy compliance gaps and recommend corrective actions to strengthen data protection practices and information governance | Assist in vendor privacy reviews and ensure third parties meet contractual privacy and data security obligations | Collaborate with security, legal, and IT teams to align privacy requirements with cybersecurity and organizational objectives | Prepare privacy awareness materials and support delivery of privacy training to staff using instructional materials and presentation skills | Evaluate regulatory, policy, and industry changes and update privacy guidance accordingly | Apply knowledge of privacy impact assessment methodologies, enterprise privacy governance models, and information privacy technologies | Support privacy audits, data flow reviews, and privacy monitoring activities across the organization","Develop and maintain privacy policies, procedures, and governance documentation aligned with regulatory requirements. | Conduct Privacy Impact Assessments (PIAs) and evaluate systems, processes, and services for privacy compliance. | Monitor organizational compliance with privacy laws, internal policies, and industry standards. | Identify privacy compliance gaps and recommend corrective actions to strengthen data protection practices. | Assist in vendor privacy reviews and ensure third parties meet contractual privacy and data security obligations. | Collaborate with security, legal, and IT teams to align privacy and cybersecurity controls. | Prepare privacy awareness materials and support delivery of privacy training to staff. | Evaluate regulatory, policy, and industry changes and update privacy guidance accordingly.","Privacy laws and regulations such as GDPR, CCPA, HIPAA, and state/federal data protection requirements. | Privacy principles, PII attributes, and data lifecycle management concepts. | Enterprise privacy governance models, policies, and compliance frameworks. | Privacy Impact Assessment (PIA) methodologies and best practices. | Cybersecurity policies, risk management concepts, and security controls that support privacy. | Organizational privacy policies, procedures, and information governance structures. | Information privacy technologies and tools used for data discovery, consent management, and privacy monitoring.","Ability to develop privacy policies, data governance procedures, and standard operating documentation. | Skill in aligning privacy requirements with cybersecurity and organizational objectives. | Ability to identify privacy compliance gaps and recommend mitigation strategies. | Skill in preparing instructional or awareness materials and presenting privacy guidance to stakeholders. | Strong communication and collaboration skills for working across legal, IT, security, and business teams.",privacy compliance | privacy impact assessment | data governance | regulatory compliance | privacy policies | PII protection | privacy risk assessment,"Bachelor’s degree in Information Security, Privacy Management, Law, Public Administration, Business, or a related field.","2–5 years of experience in privacy compliance, data governance, or related risk and regulatory functions. | Experience conducting PIAs, reviewing data flows, and supporting privacy audits. | Experience applying privacy frameworks such as ISO 27701, NIST Privacy Framework, or similar.",IAPP CIPM (Certified Information Privacy Manager) | IAPP CIPP/US or CIPP/E | ISO 27701 Lead Implementer | CompTIA Security+ (for cybersecurity alignment),2,5,0.40,0.30,0.20,0.05,0.05,60,privacy_compliance
9,Junior Security Control Assessor,"The Junior Security Control Assessor supports the evaluation of security controls across enterprise systems and assists with Security Assessment and Authorization (SA&A) activities. Working under the guidance of senior assessors, this role helps collect evidence, review documentation, verify basic control implementations, and track findings to ensure systems comply with organizational security requirements and Risk Management Framework (RMF) standards.","Assist in performing security control assessments for systems undergoing authorization or major updates using Risk Management Framework (RMF) processes | Collect evidence and documentation to support assessment of management, operational, and technical controls | Support the review of system security plans, policies, procedures, and architectural documentation for compliance | Help identify control gaps, deviations, and potential security weaknesses under senior guidance | Perform basic risk analysis of assigned controls and support the development of mitigation recommendations | Document assessment observations, deviations, and preliminary findings in accordance with RMF and Security Assessment and Authorization processes | Assist in verifying that cybersecurity controls are implemented as described in system documentation | Track remediation activities and update assessment records as systems progress through authorization steps | Apply knowledge of fundamental cybersecurity concepts including threats, vulnerabilities, and security controls | Collaborate with senior assessors, system owners, and engineering teams to support control evaluation and evidence validation","Assist in performing security control assessments for systems undergoing authorization or major updates. | Collect evidence and documentation to support assessment of management, operational, and technical controls. | Support the review of system security plans, policies, procedures, and architectural documentation. | Help identify control gaps, deviations, and potential security weaknesses under senior guidance. | Perform basic risk analysis of assigned controls and support the development of mitigation recommendations. | Document assessment observations, deviations, and preliminary findings in accordance with RMF processes. | Assist in verifying that cybersecurity controls are implemented as described in system documentation. | Track remediation activities and update assessment records as systems progress through authorization steps.","Fundamental cybersecurity concepts including threats, vulnerabilities, and security controls. | Basic understanding of the Risk Management Framework (RMF) and Security Assessment and Authorization processes. | Network security principles, networking fundamentals, and common enterprise architectures. | Cybersecurity policies, regulations, and compliance requirements relevant to system authorization. | Confidentiality, Integrity, and Availability (CIA) principles and how they apply to control assessment. | Introductory understanding of vulnerability assessment tools, system documentation, and evidence validation.","Ability to assist in evaluating security control designs and identifying control gaps. | Skill in performing basic risk analysis of systems and proposed mitigations. | Ability to support the development and documentation of security assessment findings. | Skill in reviewing technical and non-technical system documentation for compliance. | Strong communication and teamwork abilities for collaborating with senior assessors, system owners, and engineering teams.",security controls | RMF | control assessment | risk analysis | evidence collection | security authorization | compliance review,"Associate’s or Bachelor’s degree in Cybersecurity, Information Systems, Information Technology, or a related field.","0–2 years of experience in cybersecurity auditing, compliance, system security assessment, or related functions. | Exposure to NIST RMF, ISO 27001, or similar governance and compliance frameworks. | Familiarity with reviewing technical documentation such as SSPs, network diagrams, and configuration reports.",CompTIA Security+ | ISC2 Associate (toward CGRC or CISSP) | ISO 27001 Foundation | CompTIA CySA+ (nice-to-have),0,2,0.40,0.30,0.20,0.05,0.05,60,security_control_assessment
10,Cybersecurity Architect,"The Cybersecurity Architect ensures that security requirements are seamlessly integrated into enterprise architectures, systems, and services. This role designs secure frameworks, evaluates new and existing solutions for architectural weaknesses, and aligns security architecture decisions with organizational mission, business needs, and compliance obligations. The architect collaborates with engineering, operations, and leadership teams to build resilient, scalable, and secure technical environments.","Design secure architectures for enterprise systems, applications, and networks based on business and mission requirements using systems security engineering principles | Integrate organizational goals, risk objectives, and compliance requirements into security architecture decisions | Define baseline security requirements and create system security contexts, models, and concepts of operations (ConOps) | Perform architectural security reviews to identify gaps, inconsistencies, and weaknesses in systems and designs | Evaluate the cybersecurity impact of new technologies, integrations, and system changes using threat analysis and risk assessment | Develop security controls and secure design patterns aligned with defense-in-depth principles and multilayered design concepts | Determine the effectiveness of cybersecurity design decisions and validate alignment with architecture standards and frameworks | Prioritize critical capabilities and security controls required to protect essential business functions | Implement network segmentation, secure network design patterns, and layered defensive architectures | Collaborate with engineering, operations, and leadership teams to translate operational and mission requirements into actionable security architecture components | Apply knowledge of enterprise cybersecurity architecture principles, CIA concepts, and data classification to ensure secure system development","Design secure architectures for enterprise systems, applications, and networks based on business and mission requirements. | Integrate organizational goals, risk objectives, and compliance requirements into security architecture decisions. | Define baseline security requirements and create system security contexts and models. | Perform architectural security reviews to identify gaps, inconsistencies, and weaknesses in systems and designs. | Evaluate the cybersecurity impact of new technologies, integrations, and system changes. | Develop system security concepts of operations (ConOps) and architectural documentation. | Determine the effectiveness of cybersecurity design decisions and validate alignment with architecture standards. | Prioritize critical capabilities and security controls required to protect essential business functions. | Collaborate with engineering and operations to implement network segmentation, secure design patterns, and defense-in-depth strategies.","Enterprise cybersecurity architecture principles, reference models, and multilayered design concepts. | Systems security engineering (SSE) principles and secure system development practices. | Confidentiality, Integrity, and Availability (CIA) concepts and non-repudiation principles. | Cybersecurity threats, vulnerabilities, exploitation techniques, and adversarial characteristics. | Network architecture, secure network design patterns, and segmentation strategies. | Enterprise IT architecture frameworks, system engineering processes, and integration practices. | Cyber defense tools, controls, and defense-in-depth principles. | Risk management processes including identification, analysis, and prioritization of architectural risks. | Data classification concepts, multilevel security requirements, and access control models. | Cybersecurity policies, regulations, compliance requirements, and acquisition lifecycle security considerations.","Ability to design secure architectures, frameworks, and system models aligned with organizational requirements. | Skill in evaluating system and network designs to identify architectural risks and weaknesses. | Ability to develop and implement security controls and secure design patterns. | Skill in translating operational and mission requirements into actionable security architecture components. | Skill in implementing network segmentation and layered defensive architectures. | Ability to integrate business goals, mission needs, and technical constraints into architectural decisions. | Strong collaboration skills for working with stakeholders across engineering, operations, and leadership teams.",security architecture | secure design | risk management | defense in depth | network segmentation | system security engineering | architecture analysis,"Bachelor’s degree in Cybersecurity, Computer Science, Information Technology, Software Engineering, or a related technical field.","3–6 years of experience in cybersecurity engineering, system design, or architecture-focused technical roles. | Hands-on experience developing or reviewing secure system architectures, cloud architectures, or enterprise security designs. | Experience with frameworks such as NIST CSF, NIST SP 800-160 (Systems Security Engineering), or Zero Trust Architecture models.",ISC2 CISSP (preferred) | ISACA CISM (for governance alignment) | Cisco CCNP Security or CCSP (for secure network architectures) | AWS Solutions Architect – Security Specialty (for cloud-focused architects) | SABSA Foundation (optional architecture-specific credential),3,6,0.40,0.30,0.20,0.05,0.05,60,cybersecurity_architecture
11,Secure Software Engineer,"The Secure Software Engineer builds and maintains applications with strong secure coding practices. This role integrates security requirements into the software lifecycle, performs secure code reviews, and ensures applications follow secure design principles across development and deployment.","Develop secure, maintainable code aligned with secure coding standards and OWASP Top 10 vulnerability prevention | Perform code reviews to identify vulnerabilities, weaknesses, and insecure coding patterns | Integrate security requirements into application design and development workflows throughout the software development lifecycle (SDLC) | Implement input validation, error handling, and encryption where needed using secure coding practices | Conduct basic threat modeling and document application attack surfaces to identify potential security risks | Use static analysis tools to detect and mitigate coding flaws and vulnerabilities | Collaborate with engineering and security teams to ensure secure release processes and secure SDLC practices | Apply knowledge of secure design patterns, cryptography basics, and secure data handling practices | Debug software and translate requirements into secure design elements | Maintain awareness of version control, build pipelines, and configuration management tools for secure deployment","Develop secure, maintainable code aligned with secure coding standards. | Perform code reviews to identify vulnerabilities and weaknesses. | Integrate security requirements into application design and development. | Implement input validation, error handling, and encryption where needed. | Conduct basic threat modeling and document application attack surfaces. | Use static analysis tools to detect and mitigate coding flaws. | Collaborate with engineering and security teams to ensure secure release processes.","Secure coding principles and common vulnerabilities (e.g., OWASP Top 10). | Software development lifecycle (SDLC) and secure SDLC concepts. | Threat modeling basics and secure design patterns. | Version control, build pipelines, and configuration management tools. | Cryptography basics and secure data handling practices.",Skill in applying secure coding practices and debugging software. | Ability to implement input validation and secure error handling. | Skill in performing static code analysis. | Ability to translate requirements into secure design elements. | Strong communication skills for working with engineering teams.,secure coding | software security | input validation | error handling | static code analysis | threat modeling | secure SDLC,"Bachelor’s in Computer Science, Software Engineering, Cybersecurity, or a related field.",2–5 years in software development or application security. | Experience with SAST/DAST tools and secure SDLC practices.,GIAC GSSP | CSSLP | CompTIA PenTest+ | AWS or Microsoft Developer Certification,2,5,0.40,0.30,0.20,0.05,0.05,60,secure_software_development
