id,title,overview,mainResponsibilities,tasks,knowledge,skills,skillKeywords,education,preferredExperience,certifications,experienceMin,experienceMax,weight_skills,weight_knowledge,weight_tasks,weight_certifications,weight_education,thresholdScore,testCategory
12,Secure Systems Engineer,"The Secure Systems Engineer designs, develops, and maintains secure systems throughout the systems development life cycle. This role evaluates system security requirements, integrates secure configurations, performs vulnerability identification, and collaborates with engineering and operations teams to ensure systems meet security standards and operational needs.","Design and implement secure system architectures and configurations for new and existing systems using security engineering principles | Integrate cybersecurity requirements and security controls into system designs and development activities throughout the system life cycle | Identify system vulnerabilities and assist in resolving security findings and configuration issues | Perform security testing, validation, and basic system-level threat analysis using vulnerability assessment methods | Develop system security documentation including design artifacts, configuration guides, and testing procedures | Support secure system deployment, upgrades, and maintenance activities following system hardening concepts | Collaborate with DevOps, engineering, and security teams to integrate secure development lifecycle practices | Apply knowledge of secure configuration management, authentication, access control, and data protection mechanisms | Audit technical systems and analyze system performance impacts of security controls | Maintain awareness of common system vulnerabilities, secure system design patterns, and basic networking and operating system fundamentals","Design and implement secure system architectures and configurations for new and existing systems. | Integrate cybersecurity requirements and security controls into system designs and development activities. | Identify system vulnerabilities and assist in resolving security findings and configuration issues. | Perform security testing, validation, and basic system-level threat analysis. | Develop system security documentation including design artifacts, configuration guides, and testing procedures. | Support secure system deployment, upgrades, and maintenance activities. | Collaborate with DevOps, engineering, and security teams to integrate secure development lifecycle practices.","Security engineering principles and system hardening concepts. | Secure configuration management and system life cycle processes. | Common system vulnerabilities and secure system design patterns. | Basic networking and operating system fundamentals (Windows/Linux). | System security testing, validation, and vulnerability assessment methods. | Authentication, access control, and data protection mechanisms. | Risk analysis concepts and security controls applicable to system development.",Skill in designing and validating secure system configurations. | Ability to identify system vulnerabilities and security gaps. | Skill in developing and documenting system security controls. | Ability to perform basic system-level risk analysis. | Skill in auditing technical systems and analyzing system performance impacts. | Strong collaboration and communication abilities across engineering and security teams.,secure system design | system hardening | risk analysis | vulnerability identification | secure configuration | system security testing | secure SDLC,"Bachelor’s degree in Information Technology, Cybersecurity, Systems Engineering, or related field.","2–5 years of experience in systems engineering, secure system development, or security-focused DevOps. | Familiarity with system hardening benchmarks, secure deployment pipelines, and system validation techniques. | Experience supporting system testing, integration, or security reviews.","CompTIA Security+ | CompTIA CySA+ | GIAC GSEC | Microsoft or Linux systems engineering certifications (e.g., MSCA, RHCSA)",2,5,0.40,0.30,0.20,0.05,0.05,60,secure_systems_development
13,Software Security Analyst,"The Software Security Analyst evaluates the security of applications through code review, threat modeling, vulnerability analysis, and validation of secure design practices. This role supports development teams by identifying weaknesses early in the SDLC and ensuring software meets security requirements before release.","Perform secure code reviews to identify vulnerabilities, insecure coding patterns, and common software vulnerabilities such as OWASP Top 10 and CWE/SANS Top 25 | Conduct vulnerability analysis of software components, patches, and updates using static and dynamic code analysis tools | Integrate security requirements into application design and development workflows following secure SDLC practices | Conduct threat modeling and document application attack surfaces to identify potential security risks | Develop and execute security testing and validation procedures using secure test plans | Perform static code analysis with manual and automated techniques to identify security flaws | Prepare concise vulnerability analysis reports and remediation guidance for engineering teams | Collaborate with developers and engineers to ensure secure software deployment and application-level risk mitigation | Evaluate application security controls and communicate findings clearly to engineering teams | Apply knowledge of secure software development principles, risk management, and software quality assurance practices","Perform secure code reviews to identify vulnerabilities and insecure coding patterns. | Conduct vulnerability analysis of software components, patches, and updates. | Integrate security requirements into application design and development workflows. | Conduct threat modeling and document application attack surfaces. | Develop and execute security testing and validation procedures. | Prepare concise vulnerability analysis reports and remediation guidance. | Collaborate with developers and engineers to ensure secure software deployment.","Common software vulnerabilities (e.g., OWASP Top 10, CWE/SANS Top 25) and remediation techniques. | Secure software development principles and secure SDLC practices. | Threat modeling, attack surface analysis, and secure design concepts. | Static and dynamic code analysis tools and methods. | Basic networking, OS fundamentals, and application architecture concepts. | Risk management principles and application-level risk analysis. | Software quality assurance and secure deployment practices.",Skill in recognizing software vulnerabilities and insecure coding patterns. | Ability to perform static code analysis with manual and automated techniques. | Skill in designing secure test plans and evaluating application security controls. | Ability to communicate findings clearly to engineering teams. | Skill in performing application-level risk analysis and recommending mitigations.,application security | secure code review | static analysis | threat modeling | vulnerability analysis | secure SDLC | software risk assessment,"Bachelor’s in Computer Science, Software Engineering, Cybersecurity, or a related field.","1–4 years of experience in application security, secure code review, or software development. | Experience with SAST/DAST tools and secure development practices. | Understanding of threat modeling techniques and vulnerability assessment workflows.",GIAC GWAPT or GSSP | CompTIA PenTest+ | CSSLP (optional) | Vendor secure development certifications (AWS/Azure/Google),1,4,0.40,0.30,0.20,0.05,0.05,60,software_security_assessment
14,Systems Security Analyst,"The Systems Security Analyst helps ensure systems are securely configured, maintained, and monitored. This role supports vulnerability management, system hardening, access control validation, and the documentation of security operations across enterprise systems.","Scan systems for vulnerabilities and track remediation progress using vulnerability scanning and patching practices | Review system configurations and identify security gaps or misconfigurations | Support system hardening and apply security patches and updates to maintain secure configurations | Monitor security events and assist in analyzing system-level alerts for security issues | Update system security documentation and configuration records | Recommend risk mitigation steps and basic system security improvements | Evaluate basic security controls including access control and system-level security measures | Analyze logs or system activity for security issues using Windows/Linux operating system fundamentals | Apply knowledge of basic networking, firewall concepts, and configuration management practices | Collaborate with system and security teams to maintain system security across enterprise environments",Scan systems for vulnerabilities and track remediation progress. | Review system configurations and identify security gaps or misconfigurations. | Support system hardening and apply security patches and updates. | Monitor security events and assist in analyzing system-level alerts. | Update system security documentation and configuration records. | Recommend risk mitigation steps and basic system security improvements.,"System security basics including access control, vulnerabilities, and secure configurations. | Windows/Linux operating system fundamentals. | Basic networking and firewall concepts. | Vulnerability scanning, patching, and configuration management practices. | Risk management and system-level security controls.",Skill in identifying system vulnerabilities and misconfigurations. | Ability to apply secure configuration updates and patches. | Skill in evaluating basic security controls. | Ability to analyze logs or system activity for security issues. | Strong communication for working with system and security teams.,system hardening | vulnerability management | security monitoring | configuration management | access control | risk mitigation,"Bachelor’s degree in Cybersecurity, IT, Computer Science, or a related field.",1–3 years in system administration or security operations. | Experience with vulnerability scanners and basic system monitoring tools.,CompTIA Security+ | CompTIA CySA+ | GIAC GSEC,1,3,0.40,0.30,0.20,0.05,0.05,60,systems_security_analysis
15,Network Operations Analyst,"The Network Operations Analyst supports the planning, maintenance, monitoring, and security of enterprise network environments. This role ensures that network devices, connectivity, and communication paths are reliable, optimized, and protected against threats.","Monitor network performance and identify connectivity or latency issues using network monitoring methods and performance indicators | Install, configure, and maintain routers, switches, firewalls, and other network devices | Apply network patches and firmware updates to address vulnerabilities and maintain device security | Troubleshoot network outages, device failures, and configuration issues using command-line tools for diagnostics | Improve network security through proper device configuration, access controls, and secure network communication practices | Support network backup, recovery, and failover testing procedures following network contingency planning | Document network configurations, changes, and operational activities | Apply knowledge of networking fundamentals including LAN, WAN, VLANs, routing, and switching | Configure and maintain firewall concepts, VPNs, and network security practices | Execute network troubleshooting using operating system basics and network equipment operations","Monitor network performance and identify connectivity or latency issues. | Install, configure, and maintain routers, switches, firewalls, and other network devices. | Apply network patches and firmware updates to address vulnerabilities. | Troubleshoot network outages, device failures, and configuration issues. | Assist in improving network security through proper device configuration and access controls. | Support network backup, recovery, and failover testing procedures. | Document network configurations, changes, and operational activities.","Networking fundamentals including LAN, WAN, VLANs, routing, and switching. | Firewall concepts, VPNs, and secure network communication practices. | Basic cybersecurity principles and network threat concepts. | Operating system basics and command-line tools for network troubleshooting. | Network monitoring methods, performance indicators, and hardware/software components. | Patch and configuration management for network devices.","Skill in configuring routers, switches, and firewalls. | Ability to troubleshoot network equipment and connectivity issues. | Skill in applying network security practices and device hardening. | Ability to execute command-line tools for diagnostics (e.g., traceroute, netstat). | Skill in creating and testing network backup and recovery steps. | Ability to read and update network documentation and diagrams.",network monitoring | routing | switching | network security | firewalls | vulnerability patching | troubleshooting,Associate,"1–3 years of hands-on experience with networking or network security. | Experience working with enterprise routers, switches, and firewalls. | Experience with network monitoring tools (e.g., SolarWinds, Zabbix, Splunk).",CompTIA Network+ | Cisco CCNA | CompTIA Security+,1,3,0.40,0.30,0.20,0.05,0.05,60,network_operations
16,Database Security Analyst,"The Database Administrator manages and maintains secure, reliable, and efficient database systems. This role supports data storage, backup and recovery, performance tuning, and the implementation of data management standards across the organization.","Install, configure, and maintain database management systems (DBMS) using database administration skills | Monitor database performance and apply tuning or optimization as needed | Perform regular backups and support database recovery operations following data integrity and backup principles | Implement data management standards, access controls, and security policies for secure data handling | Plan for database capacity changes and future data growth using capacity planning strategies | Troubleshoot database errors, performance issues, and integrity problems | Document database procedures, configurations, and operational activities | Design effective data storage structures using database schema design and indexing strategies | Perform structured queries and automate database tasks using SQL fundamentals | Implement data protection, access controls, and encryption to ensure secure distribution of data","Install, configure, and maintain database management systems (DBMS). | Monitor database performance and apply tuning or optimization as needed. | Perform regular backups and support database recovery operations. | Implement data management standards, access controls, and security policies. | Plan for database capacity changes and future data growth. | Troubleshoot database errors, performance issues, and integrity problems. | Document database procedures, configurations, and operational activities.","Database management system (DBMS) concepts and SQL fundamentals. | Data integrity, backup, recovery, and storage principles. | Basic cybersecurity principles and secure data handling practices. | Database schema design, indexing, and optimization strategies. | Capacity planning and performance monitoring for databases. | Network and operating system basics related to database environments.","Skill in administering and maintaining relational databases. | Ability to optimize database performance and troubleshoot issues. | Skill in designing effective data storage structures. | Ability to perform structured queries and automate database tasks. | Skill in implementing data protection, access controls, and encryption. | Ability to prepare clear documentation and reporting.",database administration | SQL | backup and recovery | performance tuning | data integrity | db security | database monitoring,"Bachelor’s degree in Computer Science, Information Systems, IT, or a related field.","1–3 years of experience with database administration or data management. | Experience with SQL-based relational databases (e.g., MySQL, PostgreSQL, SQL Server, Oracle). | Familiarity with backup strategies, indexing, and database monitoring tools.",Microsoft SQL Server (MCSA) | Oracle Database Associate | CompTIA Data+ | AWS/Azure database specialty certifications (optional),1,3,0.40,0.30,0.20,0.05,0.05,60,database_administration
17,Cybersecurity Systems Administrator,"The Cybersecurity Systems Administrator is responsible for securely configuring, maintaining, and monitoring enterprise systems. This role manages user access, system updates, backups, and recovery processes while ensuring systems comply with organizational security policies.","Install, configure, and update servers and operating systems (Windows/Linux) following system administration principles | Maintain baseline system security and apply patches, updates, and configuration changes using system hardening and patch management practices | Troubleshoot system issues, hardware failures, and software interoperability problems to optimize system performance | Manage system and network user accounts, access rights, and authentication procedures following access control and password policy best practices | Monitor server configurations and ensure compliance with security policies and organizational standards | Perform system backups and support recovery operations using backup and recovery processes and redundancy techniques | Document system configurations, procedures, and administrative activities | Configure and maintain servers securely using virtualization tools and system imaging concepts | Enforce access controls and manage user access management across enterprise systems | Apply knowledge of network basics relevant to system connectivity and troubleshooting","Install, configure, and update servers and operating systems (Windows/Linux). | Maintain baseline system security and apply patches, updates, and configuration changes. | Troubleshoot system issues, hardware failures, and software interoperability problems. | Manage system and network user accounts, access rights, and authentication procedures. | Monitor server configurations and ensure compliance with security policies. | Perform system backups and support recovery operations when needed. | Document system configurations, procedures, and administrative activities.","System administration principles for Windows/Linux environments. | Access control, authentication, and password policy best practices. | Basic cybersecurity principles including system hardening and patch management. | Virtualization tools and system imaging concepts. | Backup and recovery processes and redundancy techniques. | Network basics relevant to system connectivity and troubleshooting.","Skill in administering and troubleshooting operating systems. | Ability to configure and maintain servers securely. | Skill in managing user accounts and enforcing access controls. | Ability to develop, maintain, and restore system backups. | Skill in optimizing system performance and resolving system failures.",system hardening | patch management | user access management | server configuration | backup and recovery | os administration | security monitoring,"Associate’s or Bachelor’s in Information Technology, Cybersecurity, Computer Science, or related field.","1–3 years of experience in system administration or IT operations. | Experience with Active Directory, Linux administration, or virtualization platforms. | Familiarity with system hardening guides (e.g., CIS Benchmarks).",CompTIA Security+ | CompTIA Linux+ or Server+ | Microsoft or Linux system administration certifications,1,3,0.40,0.30,0.20,0.05,0.05,60,systems_administration
18,Cybersecurity Data Analyst,"The Cybersecurity Data Analyst analyzes data from multiple systems to identify trends, anomalies, and potential security or privacy risks. This role creates metrics, validates data quality, and translates complex datasets into actionable insights that strengthen the organization’s cybersecurity posture.","Collect, organize, and analyze security data from logs, alerts, and monitoring systems using data analysis and statistical methods | Identify trends, patterns, and anomalies in security data to support threat detection and incident response | Develop dashboards, reports, and visualizations to communicate security metrics and insights to stakeholders | Support security operations by querying and correlating data from SIEM, EDR, and other security platforms | Perform basic statistical analysis and data modeling to identify security risks and operational improvements | Collaborate with security teams to translate data findings into actionable recommendations | Maintain data quality, integrity, and documentation of analytical processes | Apply knowledge of cybersecurity concepts, threat indicators, and security monitoring fundamentals | Use data visualization tools and techniques to present complex security information clearly | Support security metrics reporting and performance measurement initiatives","Analyze security, system, and operational data to identify anomalies and patterns. | Develop dashboards, metrics, and trend reports for cybersecurity teams and leadership. | Assess data quality and validate source data before analysis. | Define data requirements, standards, and collection procedures. | Perform descriptive and statistical analysis to support threat detection and risk assessments. | Prepare clear reports, summaries, and visualizations of analytical findings.","Cybersecurity principles including threats, vulnerabilities, and risk concepts. | Data analysis tools, statistical methods, and anomaly detection techniques. | Data standards, quality assessment methods, and data lifecycle practices. | Basic networking and system fundamentals relevant to cybersecurity datasets. | Privacy principles and data handling requirements.","Skill in detecting anomalies and hidden patterns in large datasets. | Ability to develop algorithms or basic analytical workflows. | Skill in applying descriptive statistics and data validation techniques. | Ability to analyze data structures and identify inconsistencies. | Skill in preparing written reports, summaries, and stakeholder briefings.",data analysis | anomaly detection | metric development | threat analytics | data quality validation | statistical analysis | cybersecurity insights,"Bachelor’s degree in Data Science, Cybersecurity, Computer Science, Information Systems, or a related field.","1–3 years of experience in data analysis, cybersecurity analytics, or security operations. | Experience with analytical tools (e.g., Python, SQL, Excel, Power BI). | Exposure to cybersecurity logs, telemetry, or incident datasets.",CompTIA Data+ | Google/AWS/Azure Data Analytics certifications | ISC2 CC or Security+ (helpful for cybersecurity context),1,3,0.40,0.30,0.20,0.05,0.05,60,cyber_data_analysis
