id,title,overview,mainResponsibilities,tasks,knowledge,skills,skillKeywords,education,preferredExperience,certifications,experienceMin,experienceMax,weight_skills,weight_knowledge,weight_tasks,weight_certifications,weight_education,thresholdScore,testCategory
1,Incident Response Analyst,"The Incident Response Analyst identifies, investigates, and responds to cybersecurity incidents across the organization. This role performs hands-on analysis of alerts, collects and processes digital evidence, coordinates containment actions, and documents findings for technical and executive audiences. The analyst works closely with SOC, engineering, and forensics teams to ensure threats are rapidly identified and mitigated.","Monitor and triage security alerts from SIEM, EDR, IDS/IPS, and threat intelligence sources using incident response methodologies such as NIST 800-61 | Investigate suspicious activity by analyzing logs, network packets, endpoint telemetry, and forensic artifacts to identify indicators of compromise | Recognize and classify vulnerabilities based on severity and impact, understanding the cyber attack lifecycle and adversary tradecraft | Collect, preserve, and process digital evidence in a forensically sound manner following chain-of-custody requirements | Perform static and dynamic malware analysis to determine behavior patterns, indicators, and potential business impact | Analyze network traffic and log sources from endpoints, servers, and cloud environments to trace attacker activity | Contain active threats by isolating endpoints, blocking malicious indicators, and executing emergency mitigations to protect systems | Develop incident timelines, root-cause analysis reports, and lessons-learned summaries using analytical and investigative methods | Collaborate with SOC, IT, engineering, and threat intelligence teams throughout the incident lifecycle | Update and refine IR playbooks, detection rules, and escalation procedures based on new learnings and emerging threats","Monitor and triage alerts from SIEM, EDR, IDS/IPS, and threat intelligence sources. | Investigate suspicious activity using logs, packets, endpoint telemetry, and forensic artifacts. | Contain active threats by isolating endpoints, blocking malicious indicators, and executing emergency mitigations. | Collect, preserve, and process digital evidence following chain-of-custody requirements. | Perform malware analysis to determine behavior, indicators, and potential business impact. | Develop incident timelines, root-cause analysis reports, and lessons-learned summaries. | Collaborate with SOC, IT, engineering, and threat intelligence teams throughout incident lifecycle. | Update and refine IR playbooks, detection rules, and escalation procedures based on new learnings.","Incident response methodologies such as NIST 800-61. | Cyber attack lifecycle, intrusion phases, and adversary tradecraft. | Malware types, behavior patterns, and analysis techniques. | Network security concepts, protocols, and intrusion detection fundamentals. | Log sources and forensic artifacts from endpoints, servers, and cloud environments.","Ability to recognize and classify vulnerabilities based on severity and impact. | Ability to collect and preserve digital evidence in a forensically sound manner. | Ability to process, analyze, and organize digital evidence for investigation. | Ability to categorize, prioritize, and validate detected vulnerabilities. | Ability to detect and protect systems against malware activity. | Ability to perform static and dynamic malware analysis. | Ability to analyze network traffic to identify suspicious and anomalous behavior. | Ability to interpret security data using analytical and investigative methods. | Ability to perform detailed log file analysis to trace attacker activity.",Incident Response | Digital evidence collection | forensic processing | malware analysis | network traffic analysis | log analysis | vulnerability triage | threat containment | alert triage | IOC detection,"Bachelor’s degree in Cybersecurity, Computer Science, Information Security, or equivalent practical experience.","2–5 years of experience in incident response, SOC operations, or digital forensics. | Experience with SIEM platforms, EDR tools, packet capture, memory analysis, and sandboxing environments.",CompTIA Security+ | EC-Council Certified Incident Handler (ECIH) | GIAC Certified Incident Handler (GCIH) | CompTIA CySA+ | GIAC Forensic Analyst (GCFA),2,5,0.35,0.25,0.20,0.10,0.10,60,incident_response
2,Threat Analysis Analyst,"The Threat Analysis Analyst identifies, evaluates, and interprets cyber threats targeting the organization. This role focuses on analyzing threat actor behavior, investigating suspicious activity, and converting raw security data into actionable intelligence that informs security operations and enhances defensive capabilities.","Collect and analyze threat data from internal and external intelligence sources to identify emerging cyber threats and threat actor tactics, techniques, and procedures (TTPs) | Investigate suspicious activities by querying and correlating large volumes of security data across multiple platforms and data sources | Develop and maintain virtualized environments to safely analyze suspicious artifacts, malware samples, and potential indicators of compromise | Perform metadata and log analysis to uncover network threats, intrusion behaviors, and anomalous patterns that may indicate malicious activity | Identify and evaluate network-based threats using threat intelligence platforms and structured intelligence formats | Conduct investigative analysis to recognize C2 patterns, malware indicators, and threat hunting fundamentals | Produce detailed and concise threat intelligence reports and summaries that communicate findings across the security team | Support proactive threat hunting activities across enterprise environments using analytical and pattern-recognition capabilities | Prepare threat intelligence briefings and communicate actionable insights to stakeholders and security operations teams",Collect and analyze threat data from internal and external intelligence sources. | Investigate suspicious activities and identify emerging cyber threats. | Develop and maintain virtualized environments to safely analyze suspicious artifacts. | Perform metadata and log analysis to uncover indicators of compromise. | Produce threat intelligence reports and communicate findings across the security team. | Support proactive threat hunting activities across enterprise environments.,"Threat actor tactics, techniques, and procedures (TTPs). | Cyber threat intelligence platforms and structured intelligence formats. | Network threats, intrusion behaviors, and security monitoring concepts. | Malware indicators, C2 patterns, and threat hunting fundamentals. | Data analysis, metadata inspection, and security-focused querying methodologies.","Ability to identify and evaluate network-based threats. | Ability to analyze suspicious artifacts using virtual environments. | Ability to query, analyze, and correlate large volumes of security data. | Ability to prepare detailed and concise threat intelligence summaries. | Ability to perform investigative metadata analysis. | Strong analytical and pattern-recognition capabilities.",Threat analysis | Threat hunting | Network threat identification | Data querying | Metadata analysis | Virtual machine operations | Security reporting | Threat intelligence | Data collection,"Bachelor’s degree in Cybersecurity, Information Technology, Computer Science, or equivalent experience.","1–3 years in threat intelligence, SOC operations, or cyber investigations. | Experience with SIEM platforms, CTI tools, and malware analysis workflows.",CompTIA Security+ | EC-Council Certified Threat Intelligence Analyst (CTIA) | GIAC Cyber Threat Intelligence (GCTI) | CompTIA CySA+,1,3,,,,,,,
3,Defensive Cybersecurity Analyst,The Defensive Cybersecurity Analyst strengthens and maintains the organization,"Monitor security tools, dashboards, and alert systems to detect suspicious activity using SIEM, IDS/IPS, and traffic analysis tools | Analyze network traffic, protocols, and logs to identify intrusion attempts, anomalies, and network-based threats | Identify, categorize, and prioritize system vulnerabilities in applications and configurations using scanning methodologies and system hardening practices | Evaluate the effectiveness of defensive security tools including firewalls, EDR, and intrusion detection solutions | Investigate network threats by correlating indicators across multiple data sources including security logs, network flow records, and event data | Perform traffic and protocol analysis for anomaly detection using network security fundamentals and common attack vector knowledge | Interpret and investigate logs from multiple sources to detect malicious activity and support incident response teams during containment | Support remediation activities by applying defensive techniques and recommending security improvements | Maintain awareness of threat detection methods, vulnerability types, and defensive security best practices","Monitor security tools, dashboards, and alert systems to detect suspicious activity. | Analyze network traffic and logs to identify intrusion attempts or anomalies. | Identify and categorize vulnerabilities in systems, applications, and configurations. | Evaluate security tools, platforms, and defense technologies for effectiveness. | Investigate network threats and correlate indicators across multiple data sources. | Support incident response teams during containment and remediation activities.","Network security fundamentals, common attack vectors, and defensive techniques. | Threat detection methods using SIEM, IDS/IPS, and traffic analysis tools. | Vulnerability types, scanning methodologies, and system hardening practices. | Security logs, network flow records, and event correlation concepts. | Defensive security tools including firewalls, EDR, and intrusion detection solutions.",Ability to detect and analyze network-based threats. | Ability to evaluate the effectiveness of defensive security tools. | Ability to categorize and prioritize system vulnerabilities. | Ability to perform traffic and protocol analysis for anomaly detection. | Ability to interpret and investigate logs from multiple sources. | Strong analytical and troubleshooting ability in security environments.,Network defense | Threat detection | Traffic analysis | Log analysis | Vulnerability identification | Security monitoring | Anomaly detection | Security tool evaluation,"Bachelor’s degree in Cybersecurity, Information Technology, Computer Science, or equivalent experience.","1–3 years working in SOC operations, defensive cybersecurity, or security monitoring. | Experience using SIEM platforms, IDS/IPS, threat detection tools, and vulnerability scanners.",CompTIA Security+ | CompTIA CySA+ | EC-Council Certified SOC Analyst (CSA) | GIAC Certified Defense Analyst (GCDA),1,3,,,,,,,
4,Digital Forensics Investigator,"The Digital Forensics Investigator examines compromised systems, collects and preserves digital evidence, and performs in-depth forensic analysis to support incident response, legal proceedings, and organizational investigations. This role focuses on identifying malicious activity, reconstructing events, and ensuring evidence integrity throughout the investigative lifecycle.","Collect digital evidence from endpoints, servers, and cloud environments following chain-of-custody requirements and evidence-handling best practices | Preserve and process digital artifacts using validated forensic tools and methodologies while maintaining forensic soundness | Perform memory forensics, disk imaging, and file system analysis to uncover malicious activity and attacker tradecraft | Analyze logs, metadata, registry data, and system traces to reconstruct timelines and identify indicators of compromise | Conduct forensic analysis of memory structures, file systems, and log sources to interpret malware behavior and intrusion techniques | Apply digital forensic methodologies and legal requirements to ensure evidence admissibility in investigations and legal proceedings | Document investigations thoroughly and create detailed technical forensic reports for incident response teams and legal authorities | Maintain forensic toolkits, methodologies, and documentation to ensure investigation quality, repeatability, and compliance | Collaborate with SOC teams, law enforcement, and legal counsel to support cybercrime investigations and incident response activities","Collect digital evidence from endpoints, servers, and cloud environments following chain-of-custody requirements. | Preserve and process digital artifacts using validated forensic tools and methodologies. | Perform memory forensics, disk imaging, and file system analysis to uncover malicious activity. | Analyze logs, metadata, and system traces to reconstruct timelines and identify attacker behavior. | Prepare detailed forensic reports and communicate findings to incident response teams and legal authorities. | Maintain forensic toolkits, methodologies, and documentation to ensure investigation quality and repeatability.","Digital forensic methodologies, chain-of-custody procedures, and evidence-handling best practices. | Memory forensics techniques, disk imaging processes, and file system structures. | Log correlation techniques, registry analysis, and metadata interpretation. | Malware behavior, intrusion techniques, and attacker tradecraft. | Legal and regulatory requirements related to forensic investigations and evidence admissibility.","Ability to collect digital evidence safely and accurately during an investigation. | Ability to preserve and process evidence while maintaining forensic soundness. | Ability to perform memory, file system, and log analysis to uncover malicious activity. | Ability to interpret forensic data, reconstruct events, and identify indicators of compromise. | Ability to document investigations and create detailed technical forensic reports. | Strong analytical and problem-solving skills when working with complex data sets.",Digital Evidence Handling | Evidence Collection | Evidence Processing | Memory Forensics | File System Forensics | Log Analysis | Forensic Analysis | Technical Reporting,"Bachelor’s degree in Cybersecurity, Digital Forensics, IT, Computer Science, or a related discipline.","3–7 years of experience in digital forensics, incident response, or cybercrime investigation. | Hands-on experience with forensic tools such as EnCase, FTK, Volatility, Autopsy, X-Ways, or KAPE. | Experience working with SOC teams, law enforcement, or legal counsel on investigations.",GIAC Certified Forensic Analyst (GCFA) | GIAC Certified Forensic Examiner (GCFE) | Certified Forensic Computer Examiner (CFCE) | CompTIA Cybersecurity Analyst (CySA+) | EnCase Certified Examiner (EnCE),3,7,,,,,,,
5,Insider Threat Analyst,"The Insider Threat Analyst identifies, investigates, and assesses potential internal risks within the organization by analyzing user behavior, system logs, anomalous activity patterns, and data movement. This role collaborates closely with security teams, HR, and management to prevent misuse, data exfiltration, and insider-driven security breaches.","Analyze user activity, system logs, and behavioral patterns using user behavior analytics (UBA) and insider threat detection methods to detect suspicious or high-risk actions | Investigate potential insider threat cases by correlating technical indicators from authentication logs, access logs, email logs, and endpoint activity with contextual information | Develop analytical models, algorithms, and dashboards to identify insider threat patterns, anomalies, and suspicious trends in large datasets | Query and analyze data sources to detect risk indicators related to data misuse, privilege abuse, or policy violations | Perform threat analysis and behavioral analysis to identify patterns of data exfiltration or unauthorized access | Collaborate with HR, security teams, IT, and leadership to validate findings, escalate critical cases, and support stakeholder communication | Prepare detailed reports and briefings to communicate analysis results, investigation findings, and recommendations to stakeholders | Maintain documentation of incident investigations, escalation processes, and mitigation recommendations | Present findings to audiences across the organization and support cross-functional collaboration on insider threat prevention","Analyze user activity, system logs, and behavioral patterns to detect suspicious or high-risk actions. | Investigate potential insider threat cases by correlating technical indicators and contextual information. | Develop analytical models and dashboards to identify insider threat patterns. | Collaborate with HR, security teams, and leadership to validate findings and escalate critical cases. | Prepare detailed reports and briefings to communicate analysis results to stakeholders. | Maintain documentation of incident investigations and provide recommendations for mitigation.","User behavior analytics (UBA) and insider threat detection methods. | Data correlation, anomaly detection, and behavioral pattern identification. | Log sources such as authentication logs, access logs, email logs, and endpoint activity. | Risk indicators related to data misuse, privilege abuse, or policy violation. | Stakeholder communication and escalation processes.","Strong ability to perform insider threat and behavioral analysis. | Ability to analyze large datasets and identify anomalies or suspicious trends. | Effective written and verbal communication for preparing reports and briefings. | Ability to collaborate with cross-functional teams including HR, IT, and security. | Strong proficiency in querying data sources and interpreting results.",threat analysis | behavioral analysis | data analysis | log analysis | pattern detection | report writing | insider threat investigation,"Bachelor’s in Cybersecurity, Computer Science, Information Systems, Psychology, or a related field.","1–4 years of experience in threat analysis, SOC operations, or security monitoring. | Experience with UEBA tools, SIEM platforms, data analysis tools, and case management systems.",CompTIA Security+ | EC-Council Certified Threat Intelligence Analyst (CTIA) | GIAC Cyber Threat Intelligence (GCTI) | CompTIA CySA+,1,4,0.40,0.30,0.20,0.05,0.05,60,insider_threat
6,Vulnerability Analyst,"The Vulnerability Analyst identifies weaknesses across enterprise systems, applications, and networks by conducting structured assessments, reviewing system configurations, analyzing risk impact, and validating compliance with cybersecurity policies. This role plays a key part in reducing organizational exposure by prioritizing remediation efforts and ensuring continuous alignment with best-practice security standards.","Evaluate systems, networks, and applications to identify vulnerabilities, security control gaps, and configuration weaknesses using vulnerability scanning and assessment tools | Assess organizational cybersecurity posture for compliance with internal policies, regulatory requirements, and industry standards such as NIST, ISO 27001, or CIS Benchmarks | Analyze network traffic, logs, and indicators of compromise to identify anomalous activity and potential exploitation attempts | Perform risk and vulnerability assessments by documenting severity, likelihood, and operational impact of identified weaknesses | Identify and validate software, network, and application vulnerabilities using penetration testing principles and vulnerability validation techniques | Prepare audit and assessment reports summarizing findings, risk levels, and recommended remediation actions for stakeholders | Maintain and deploy vulnerability assessment and cyber defense audit toolkits across enterprise environments | Correlate data from scans, logs, and incident reports to identify systemic weaknesses and defense-in-depth gaps | Recommend remediation and mitigation strategies to reduce exposure, applying knowledge of cybersecurity threats, exploits, and adversarial tactics | Translate technical findings into clear, actionable remediation steps for system owners, IT teams, and management","Evaluate systems, networks, and applications to identify vulnerabilities and security control gaps. | Assess organizational cybersecurity posture for compliance with internal policies, regulatory requirements, and industry standards. | Analyze network traffic, logs, and indicators of compromise to identify anomalous activity. | Perform risk and vulnerability assessments and document severity, likelihood, and operational impact. | Prepare audit and assessment reports summarizing findings, risk levels, and recommended remediation actions. | Maintain and deploy vulnerability assessment and cyber defense audit toolkits. | Correlate data from scans, logs, and incident reports to identify systemic weaknesses. | Recommend remediation and mitigation strategies to reduce exposure across environments.","Networking protocols, network architectures, and common enterprise IT environments. | Cybersecurity policies, procedures, regulatory requirements, and compliance frameworks. | Cybersecurity threats, vulnerabilities, exploits, and adversarial tactics. | Application security fundamentals and common application vulnerabilities. | Defense-in-depth principles, enterprise architecture concepts, and security best practices. | Penetration testing principles, tools, and vulnerability validation techniques. | Cyber defense auditing processes, laws, and policy requirements.","Ability to identify and validate software, network, and application vulnerabilities. | Proficiency in vulnerability scanning and configuration assessment tools. | Skill in analyzing network data, logs, and indicators of anomalous activity. | Ability to assess application vulnerabilities and interpret their technical impact. | Ability to translate technical findings into clear, actionable remediation steps for stakeholders.",vulnerability scanning | risk assessment | network analysis | application security | threat identification | security auditing | policy compliance,"Bachelor’s degree in Cybersecurity, Computer Science, Information Technology, Information Systems, or a related field.","2–5 years of experience in vulnerability management, security auditing, or security operations. | Hands-on experience with tools such as Nessus, Qualys, Burp Suite, OpenVAS, or similar. | Experience working with compliance frameworks such as NIST, ISO 27001, or CIS Benchmarks.",CompTIA Security+ | CompTIA CySA+ | EC-Council CEH (Certified Ethical Hacker) | CompTIA PenTest+,2,5,0.40,0.30,0.20,0.05,0.05,60,vulnerability_analysis
